date_scheduled, event_id
2024-01-25 23:40:55,Science Communication for Beginners-2024-02-01T12:00:00.000Z-1200223808783667251
2024-01-25 23:40:55,UH SACNAS + Altair Lunch n Learn: Data Science and Machine Learning-2024-02-12T12:00:00.000Z-1200223810700464219
2024-01-25 23:40:56,Painting by the Fountains-2024-01-27T12:00:00.000Z-1200223812973764770
2024-01-25 23:40:56,Freshman/Transfer Mentorship Program Resume Workshop with CRAM CREW-2024-02-08T11:00:00.000Z-1200223814764744704
2024-01-28 21:00:58,UH SACNAS + Altair Lunch n Learn: Data Science and Machine Learning-2024-02-12T18:00:00.000Z-1201361315592151151
2024-01-28 21:00:58,Freshman/Transfer Mentorship Program Resume Workshop with CRAM CREW-2024-02-08T17:00:00.000Z-1201361318402338826
2024-01-28 21:00:59,Science Communication for Beginners-2024-02-01T18:00:00.000Z-1201361320197509200